kode,nama_old,developer_old,kecamatan_old,terjual_subsidi,terjual_komersil,total_terjual
LMJ1620042026T001,GRIYA SEMERU WONOREJO,PT ASIA LAND INDONESIA,Kedungjajang,1,0,1
LMJ0920052025T001,GRAHA ADHI 7,PT GRAHA DUTA BANGSA,Tekung,1,0,1
LMJ1010102025T002,HR RESIDENCE TAHAP 2,PT NABAWI INDAH PERMAI,Lumajang,1,0,1
LMJ0920082025T001,BHUMI SAKA ARUM,PT LEMBAYUNG WANANTARA PADHA,Tekung,1,0,1
LMJ1520092024T002,TAMAN GRIYA PERMATA,PT GRAND ZAMZAM PROPERTY,Sukodono,1,0,1
LMJ0520102023T001,PULO PERMATA GARDEN,PT BUMI WIRARAJA GROUP,Tempeh,1,0,1
LMJ2120032020T001,MAHAMERU RESIDENCE,PT MORU KAIA JAYA UTAMA,Sumbersuko,1,0,1
