kode,nama_old,developer_old,kecamatan_old,terjual_subsidi,terjual_komersil,total_terjual
LMJ1620042026T001,GRIYA SEMERU WONOREJO,PT ASIA LAND INDONESIA,Kedungjajang,2,0,2
LMJ2120052025T001,graha surya mojosari,PT SURYA KENCANA REALTY,Sumbersuko,2,0,2
LMJ1010052025T001,Leiden Park,PT BINTANG INDONESIA SENTOSA,Lumajang,0,1,1
LMJ0920082025T001,BHUMI SAKA ARUM,PT LEMBAYUNG WANANTARA PADHA,Tekung,1,0,1
LMJ1520052023T001,Hasanah Park (hasanah view tahap 2),PT BINTANG INDONESIA SENTOSA,Sukodono,0,1,1
LMJ1520092023T001,Taman Selokgondang Asri,PT GRAND ZAMZAM PROPERTY,Sukodono,1,0,1
